{
  "title": "病区药品管理流程",
  "subtitle": "从医嘱到执行记录",
  "channel": "wechat-long",
  "layout": "workflow",
  "density": "standard",
  "theme": "medical-blue",
  "evidence_mode": "balanced",
  "language": "zh-CN",
  "pages": 1,
  "sections": [
    {"title": "医嘱开立", "items": ["药品选择", "剂量频次"]},
    {"title": "药师审核", "items": ["适应证", "相互作用"]},
    {"title": "药房调剂", "items": ["摆药", "复核"]},
    {"title": "病区接收", "items": ["交接确认", "储存管理"]},
    {"title": "床旁执行", "items": ["身份核对", "药品核对"]},
    {"title": "记录追溯", "items": ["执行时间", "异常记录"]}
  ],
  "sources": [{"title": "示例输入材料", "url": "", "date": "2026-08-11"}]
}
